BCNSHP,BOYSHP,CATCAM,CATLAM,COLOUR,COLPAT,NOBJNAM,OBJNAM,latitude,longitude
3,,,2,3,,牛島灯標,Ushi Shima Light Beacon,34.3666444,133.7795972
,4,3,,"6,2",,水島航路第２号灯浮標,Mizushima Traffic Route No.2 Lt Buoy,34.3678639,133.8242694
,4,1,,"2,6",,坂出港第１号灯浮標,Sakaide Ko No.1 Lt Buoy,34.3549049,133.871760099999
,4,,2,3,,備讃瀬戸南航路第８号灯浮標,Bisan Seto S Traffic Route No.8 Lt Buoy,34.3329747,133.757918499999
,4,,1,4,,備讃瀬戸南航路第７号灯浮標,Bisan Seto S Traffic Route No.7 Lt Buoy,34.3379765,133.7543288
,4,,1,4,,丸亀港灯浮標,Marugame Ko Lt Buoy,34.3053103,133.7715139
,4,,1,4,,水島航路第３号灯浮標,Mizushima Traffic Route No.3 Lt Buoy,34.3663083,133.8021056
,4,,2,3,,水島航路第４号灯浮標,Mizushima Traffic Route No.4 Lt Buoy,34.3700146,133.8115928
,4,,2,3,,備讃瀬戸南航路第１０号灯浮標,Bisan Seto South Traffic Route No.10 Lt Buoy,34.3549254,133.8126145
,4,,2,3,,宇多津港灯浮標,Utazu Ko Lt Buoy,34.3237145,133.816260199999
,4,,1,4,,坂出番の州泊地第１号灯浮標,Sakaide Bannosu Hakuchi No.1 Lt Buoy,34.3619962,133.8473189
,4,,2,3,,坂出番の州泊地第２号灯浮標,Sakaide Bannosu Hakuchi No.2 Buoy,34.361466,133.8413289
,4,,2,3,,坂出港第２号灯浮標,Sakaide Ko No.2 Lt Buoy,34.3455149,133.859685899999
,4,,1,4,,備讃瀬戸北航路第９号灯浮標,Bisan Seto North Traffic Route No.9 Light Bouy,34.3682528,133.764691699999
,1,,2,3,,,,34.3575618,133.8332311
,2,,2,3,,,,34.3035133,133.776254599999
,2,,2,3,,,,34.3029493,133.7767337
,1,,2,3,,,,34.2865788,133.7546092
,6,,,11,,,,34.3032097,133.7764905
,4,,,6,,放水口,Outlet,34.3571486,133.826236
,1,,,6,,取水口,Intake,34.3423032,133.8704175
3,,1,,"2,6",,六口島灯標,Mukuchi Shima Lt Beacon,34.4315833,133.7606667
3,,1,,"2,6",,長太夫礁灯標,Chodayu Sho Lt Beacon,34.3732171,133.1387867
1,,2,,"2,6,2",,六ツ瀬灯標,Mutsu Se Lt Beacon,34.1946146,133.1298073
3,,1,,"2,6",,海獺磯灯標,Ashika Iso,34.0669389,133.1315528
1,,,,"2,3,2",1,波節岩灯標,Habushi Iwa Lt Beacon,34.3450568,133.7131539
1,,,,"2,3,2",1,鴻石灯標,Konoishi Lt Beacon,34.3660222,133.4265278
1,,,,"2,3,2",1,油礁灯浮標,Abura Sho Lt Beacon,34.3649167,133.3607222
1,,,,"2,3,2",1,カタビラゾワイ灯標,Katabirazowai Lt Beacon,34.371575,133.2845972
3,,,,"2,3,2",1,燧灘沖ノ瀬灯標,Hiuchi Nada Okino Se Lt Beacon,34.1051556,133.105897199999
3,,,,"2,3,2",1,綿巻磯灯標,Watamaki Iso Lt Beacon,34.1602056,133.0290694
3,,,,"2,3,2",1,帆掛石立標,Hokake Ishi Beacon,34.4446056,133.9652361
3,,,1,4,,爼石灯標,Manaita Ishi Lt Beacon,34.4471306,133.9690556
3,,,1,4,,犬戻鼻灯標,Inumodori Hana Lt Beacon,34.4549833,133.9433667
3,,,1,4,,久須見鼻灯標,Kusumi Hana Lt Beacon,34.4290556,133.8206111
3,,,2,3,,牛島灯台,Ushi Shima Lt Beacon,34.3666444,133.7795972
3,,,1,4,,百間礁灯標,Hyakken Zowai Lt Beacon,34.4215,133.495722199999
3,,,2,3,,三玉岩灯標,Mitama Iwa Lt Beacon,34.2480694,133.6725361
3,,,2,3,,福山港小皇后灯標,Fukuyama Ko Kokogo Lt Beacon,34.3802694,133.3874639
3,,,2,3,,大野ゾワイ灯標,Ono Zowai Lt Beacon,34.3760278,133.3035
3,,,1,4,,クリクワゾワイ灯標,Kurikuwa Zowai Lt Beacon,34.3822689,133.292468899999
3,,,2,3,,寅丸礁灯標,Toramaru Sho Lt Beacon,34.3410088,133.0961572
3,,,2,3,,三床礁灯標,Mitoko Sho Lt Beacon,34.2575223,133.1262063
3,,,2,3,,舟折岩灯標,Funaori Iwa Lt Beacon,34.1964917,133.0916528
7,,,1,4,,福山港第１号灯標,Fukuyama Ko No 1,34.3871306,133.4431361
7,,,2,3,,福山港第２号灯標,Fukuyama Ko No 2,34.3871306,133.4482472
7,,,1,4,,福山港第３号灯標,Fukuyama Ko No 3,34.4049444,133.4445833
7,,,2,3,,福山港第４号灯標,Fukuyama Ko No 4,34.4049444,133.4485278
1,,,,6,,宇野港田井灯標,Uno Ko Tai Lt Beacon,34.5148806,133.9671611
1,,,,,,,,34.3606,133.1254444
,4,4,,"6,2,6",1,オーソノ瀬灯浮標,Osono Se Lt Buoy,34.4235278,133.948425
,4,2,,"2,6,2",1,高洲東方灯浮標,Taka Su Eastward Lt Buoy,34.4465778,133.8923167
,4,1,,"2,6",1,坂出第１号灯浮標,Sakaide Ko No.1,34.3548611,133.8716389
,4,3,,"6,2",1,ネヅラ岩南灯浮標,Nezura Iwa S Lt Buoy,34.2988056,133.5193056
,4,2,,"2,6,2",1,鍋磯東灯浮標,Nabe Iso E Lt Buoy,34.0182861,133.5148639
,4,2,,"2,6,2",1,オゴ岩東方灯浮標,Ogo Iwa Eastward Lt Buoy,34.1516111,133.4640556
,4,4,,"6,2,6",1,立花ノ州西方灯浮標,Tachibana-no Su Westward Lt Buoy,34.3496389,133.2062778
,4,3,,"6,2",1,バンダイ瀬南東方灯浮標,Bandai Se Southeastward Lt Buoy,34.0957722,133.2062778
,4,1,,"2,6",1,森ノ瀬ノ州北東方灯浮標,Mori-no-Se-no Su Northeastward Lt Buoy,34.3538056,133.225444399999
,4,3,,"6,2",1,水島航路第２号灯浮標,Mizushima Traffic Route No.2,34.3678639,133.8242694
,4,3,,"6,2",1,森ノ瀬ノ州南東方灯浮標,Mori-no-Se-no Su Southeastward Lt Buoy,34.3440833,133.2248889
,4,,,"2,3,2",1,沖ノハチカサノ瀬南東灯浮標,Oki-no-Hachikasa-no Se Southeastward Lt Buoy,34.3251944,133.3965306
,4,,1,4,,備讃瀬戸東航路第１号灯浮標,Bisan-Seto E Traffic Route No.1,34.4149167,133.9301111
,4,,1,4,,宇高東航路第３灯浮標,Uko E Passage No.3,34.4285278,133.9814778
,4,,2,3,,水島港玉島西第２号灯浮標,Mizushima Ko Tamashima No.2,34.4887778,133.66675
,4,,2,3,,ガンツガ瀬北方灯浮標,Gantsuga Se Northward Lt Buoy,34.4340778,133.7206667
,4,,1,4,,トクダキノ石灯浮標,Tokudakino Ishi Lt Buoy,34.4385194,133.700111099999
,4,,1,4,,備讃瀬戸南航路第７号灯浮標,Bisan-Seto S Traffic Route No.7,34.3379778,133.7542778
,4,,1,4,,備讃瀬戸北航路第７号灯浮標,Bisan-Seto N Traffic Route No.7,34.352975,133.7156694
,4,,1,4,,備讃瀬戸北航路第５号灯浮標,Bisan-Seto N Traffic Route No.5,34.3418083,133.6787278
,4,,2,3,,備讃瀬戸南航路第６号灯浮標,Bisan-Seto S Traffic Route No.6,34.3085361,133.7056722
,4,,2,3,,備讃瀬戸南航路第８号灯浮標,Bisan-Seto S Traffic Route No.8,34.3329778,133.7578889
,4,,1,4,,水島港玉島第１号灯浮標,Mizushima Ko Tamashima No.1,34.4889167,133.6640278
,4,,1,4,,備讃瀬戸北航路第３号灯浮標,Bisan-Seto N Traffic Route No.3,34.3317806,133.6570639
,4,,2,3,,備讃瀬戸北航路第２号灯浮標,Bisan-Seto N Traffic Route No.2,34.3088667,133.6229
,4,,1,4,,備讃瀬戸南航路第１号灯浮標,Bisan-Seto S Traffic Route No.1,34.2960361,133.620680599999
,4,,1,4,,備讃瀬戸南航路第３号灯浮標,Bisan-Seto S Traffic Route No.3,34.2963139,133.6620639
,4,,1,4,,似骨ノ礁灯浮標,Niboneno Sowa Lt Buoy,34.3721278,133.2298778
,4,,2,3,,馬立ノ鼻沖灯浮標,Umatate-no Hana Offing Lt Buoy,34.2945278,133.2284917
,4,,1,4,,宇高西航路第１号灯浮標,Uko W Passage No.1,34.3897278,133.9812
,4,,2,3,,宇高東航路第２号灯浮標,Uko E Passage No.2,34.4035861,133.9921444
,4,,1,4,,来島海峡航路第７号灯浮標,Kurushima-kaikyo Traffic Route No.7,34.1377222,133.0035278
,4,,1,4,,来島海峡航路第９号灯浮標,Kurushima-Kaikyo Traffic Route No.9,34.0979889,133.0361556
,4,,2,3,,来島海峡航路第１０号灯浮標,Kurushima-Kaikyo Traffic Route No.10,34.0844917,133.0381
,4,,2,3,,ワンワン瀬灯浮標,Wanwan Se Lt Buoy,34.2318639,133.1404472
,4,,2,3,,備前大畠沖灯浮標,Bizen-Obatake Offing Lt Buoy,34.4363,133.8214917
,4,,2,3,,園ノ洲灯浮標,So-no Su Lt Buoy,34.3801944,133.7323333
,4,,1,4,,備讃瀬戸南航路第５号灯浮標,Bisan-Seto S Traffic Route No.5,34.3140333,133.7020611
,4,,1,4,,琴浦港第１号灯浮標,Kotoura Ko No.1,34.4596333,133.8564861
,4,,1,4,,琴浦港沖灯浮標,Kotoura Ko Offing Lt Buoy,34.4621306,133.8358333
,4,,2,3,,琴浦港第２号灯浮標,Kotoura Ko No.2,34.4688056,133.8362222
,4,,1,4,,備讃瀬戸北航路第９号灯浮標,Bisan-Seto N Traffic Route No.9,34.3682528,133.764691699999
,4,,2,3,,備讃瀬戸南航路第１０号灯浮標,Bisan-Seto S Traffic Route No.10,34.3549222,133.8126056
,4,,2,3,,坂出番の州泊地第２号灯浮標,Sakaide Bannosu Hakuchi No.2,34.36145,133.8413528
,4,,1,4,,坂出番の州泊地第１号灯浮標,Sakaide Bannosu Hakuchi No.1,34.362,133.8473333
,4,,1,4,,水島航路第３号灯浮標,Mizushima Traffic Route No.3,34.3663083,133.8021056
,4,,2,3,,水島航路第４号灯浮標,Mizushima Traffic Route No.4,34.3700306,133.8116056
,4,,1,4,,水島航路第５号灯浮標,Mizushima Traffic Route No.5,34.3854722,133.7984389
,4,,2,3,,水島航路第６号灯浮標,Mizushima Traffic Route No.6,34.3875,133.8056611
,4,,1,4,,水島航路第７号灯浮標,Mizushima Traffic Route No.7,34.4045806,133.7903278
,4,,2,3,,水島航路第８号灯浮標,Mizushima Traffic Route No.8,34.4071361,133.7976611
,4,,1,4,,水島航路第９号灯浮標,Mizushima Traffic Route No.9,34.4231917,133.7792722
,4,,2,3,,水島航路第１０号灯浮標,Mizushima Traffic Route No.10,34.4263278,133.7853833
,4,,2,3,,笠岡港口第２号灯浮標,Kasaoka Ko-guchi No.2,34.4562083,133.5349611
,4,,2,3,,宇多津港灯浮標,Utazu Ko Lt Buoy,34.3237583,133.8162167
,4,,1,4,,丸亀港灯浮標,Marugame Ko Lt Buoy,34.3052583,133.7715
,4,,1,4,,詫間港第１号灯浮標,Takuma Ko No.1,34.2477083,133.6784528
,4,,1,4,,布刈岩灯浮標,Mekari Iwa Lt Buoy,34.3646278,133.17405
,4,,2,3,,細ノ州北西方灯浮標,Hoso-no Su Northwestward Lt Buoy,34.3725356,133.1236776
,4,,2,3,,瀬戸田水道南口灯浮標,Setoda Suido South Entrance Lt Buoy,34.2985051,133.0743598
,4,,2,3,,城出シ磯北西方灯浮標,Shirodashi Iso Northwestward Lt Buoy,34.3751889,133.4512472
,4,,2,3,,詫間港第２号灯浮標,Takuma Ko No.2,34.2474861,133.6773417
,4,,,"3,1",2,備讃瀬戸東航路中央第１灯浮標,Bisan-Seto E Traffic Route Center No.1,34.3915861,133.8773194
,4,,,"3,1",2,備讃瀬戸東航路中央第２号灯浮標,Bisan-Seto E Traffic Route No.2,34.4111667,133.9424528
,4,,,"3,1",2,薑鼻北東方灯浮標,Hajikami Hana Northeastward Lt Buoy,34.4071361,133.7165
,4,,,"3,1",2,備後灘航路第７号灯浮標,Bingo-Nada Passage No.7,34.2857556,133.5454083
,4,,,"3,1",2,仙酔島南方灯浮標,Sensui Shima Southward Lt Buoy,34.3549111,133.395975
,4,,,"3,1",2,走島東方灯浮標,Hashiri Shima Toho Lt Buoy,34.3349167,133.4779139
,4,,,"3,1",2,備後灘航路第６号灯浮標,Bingo-Nada Passage No.6,34.2688139,133.4831917
,4,,,"3,1",2,備後灘航路第５号灯浮標,Bingo-Nada Passage No.5,34.2526944,133.4229444
,4,,,"3,1",2,備後灘航路第４号灯浮標,Bingo-Nada Passage No.4,34.2315917,133.3373722
,4,,,"3,1",2,新居浜東航路第１号灯浮標,Niihama E Passage No.1,34.1874306,133.4215333
,4,,,"3,1",2,新居浜港東航路第２号灯浮標,Niihama E Passage No.2,34.1077167,133.3593194
,4,,,"3,1",2,備後灘航路第３号灯浮標,Bingo-Nada Passage No.3,34.2102028,133.2532139
,4,,,"3,1",2,備後灘航路第２号灯浮標,Bingo-Nada Passage No.2,34.1763333,133.191555599999
,4,,,"3,1",2,新居浜東航路第３号灯浮標,Niihama E Passage No.3,34.0443889,133.311825
,4,,,"3,1",2,備後灘航路第１号灯浮標,Bingo-Nada Passage No.1,34.1335417,133.1157306
,4,,,"3,1",2,竪場島灯浮標,Tateba Shima Lt Buoy,34.4307472,133.8542667
,4,,,"3,1",2,直島北西方灯浮標,Naoshima,34.4801056,133.9617
3,,,,"2,3,2",1,讃岐水ノ子礁灯標,Sanuki-Mizu-no-Ko Sho Lt Beacon,34.49687,134.4097979
3,,,2,3,,大串埼沖灯標,Okushi Saki Offing Lt Beacon,34.3702056,134.2111806
3,,,2,3,,カナワ岩灯標,Kanawa Iwa Lt Beacon,34.4216056,134.130125
,,,,,,,,34.460591,134.3218158
,4,2,,"2,6,2",1,稲木出シ灯浮標,Inagi Dashi Lt Buoy,34.379425,134.0839694
,4,2,,"2,6,2",1,カマ瀬東ノ州灯浮標,Kama Se Higashi-no Su Lt Beacon,34.3802833,134.0273917
,4,3,,"6,2",1,カマ瀬中ノ州灯浮標,Kama Se Naka-no Su Lt Beacon,34.3838213,134.0034477
,4,,2,3,,百尋磯灯浮標,Hyakuhiro Iso Lt Buoy,34.4660278,134.1384056
,4,,2,3,,豊島甲埼沖灯浮標,Teshima Ko Saki Offing Lt Buoy,34.4915778,134.0381361
,4,,1,4,,土庄東港灯浮標,Tonosho-Higashi-Ko Lt Buoy,34.4679722,134.1814583
,4,,2,3,,沖ノハナゲ西灯浮標,Oki-no-Hanage W Lt Buoy,34.4442278,134.2722833
,4,,2,3,,地ノハナゲ西灯浮標,Ji-no-Hanage W Lt Buoy,34.4518639,134.2753389
,4,,2,3,,高松東航路灯浮標,Takamatsu E Passage Lt Buoy,34.3999222,134.1214639
,4,,1,4,,直島漁協角埼沖のり養殖漁場Ａ灯浮標,A,34.4548611,134.0197222
,4,,1,4,,直島漁協角埼沖のり養殖漁場Ｂ灯浮標,B,34.4644444,134.0229167
,4,,2,3,,小豆島西航路第２号灯浮標,Shodoshima W Passage No.2 Lt Buoy,34.4754694,134.1331278
,4,,1,4,,土庄港灯浮標,Tonosyo Ko Lt Buoy,34.4963028,134.1672917
,4,,,"3,1",2,播磨灘航路第２号灯浮標,Harima Nada Koro No.2 Lt Buoy,34.4324336,134.4406296
,4,,,"3,1",2,播磨灘航路第１号灯浮標,Harima Nada Koro No.1 Lt Buoy,34.4003982,134.347625599999
,4,,,"3,1",2,備讃瀬戸東航路中央第６号灯浮標,Bisan Seto E Traffic Route Center No.6,34.4202,134.1720167
,4,,,"3,1",2,備讃瀬戸東航路中央第７号灯浮標,Bisan-Seto E Traffic Route Center No.7 Lt Buoy,34.4017267,134.2229167
,4,,,"3,1",2,播磨灘北航路第１号灯浮標,Harima-Nada N Passage No.1 Lt Buoy,34.4618583,134.02675
,4,,,"3,1",2,備讃瀬戸東航路中央第４号灯浮標,Bisan-Seto E Traffic Route Center No.4 Lt Buoy,34.4447778,134.0591083
,4,,,"3,1",2,備讃瀬戸東航路中央第３号灯浮標,Bisan-Seto E Traffic Route Center No.3 Lt Buoy,34.4260278,134.0156972
,4,,,"3,1",2,高松中航路灯浮標,Takamatsu Center Passage Lt Buoy,34.3885333,134.0728583
,4,,,"3,1",2,備讃瀬戸東航路中央第５号灯浮標,Bisan Seto E Traffic Route Center No.5,34.4376972,134.107852799999
,4,,,"3,1",2,高松港灯浮標,Takamatsu Ko Lt Buoy,34.3656111,134.0535
,4,,,6,,,,34.2321608,134.4348094
